{
  "slug": "gimyujin",
  "name": "김유진",
  "title": "과장",
  "photo": "https://s3.amazonaws.com/webflow-prod-assets/69d090ea69d828e27d16ea29/6acc8798cdd337debbd36a22_%EA%B9%80%EC%9C%A0%EC%A7%84.webp",
  "education": [
    "서울대학교 수의과대학 수의안과/치과학 석사",
    "서울대학교 수의과대학 졸업"
  ],
  "career": [
    "현) 헬릭스동물메디컬센터 서초 본원 안과/치과과장",
    "전) VIP동물의료센터 성북점 수련수의사",
    "전) VIP동물의료센터 청담점 진료수의사",
    "전) 서울대학교 수의과대학 부속동물병원 진료수의사",
    "전) 서울대학교 수의과대학 부속동물병원 전임수의사"
  ],
  "activities": [
    "2025 미국수의안과학회 (American College of Veterinary Ophthalmologists, ACVO 2025 Conference) 발표 — \"Mobile Smartphone-Based Imaging of Ex Vivo Porcine Corneal Endothelium Using Specular Reflection from a Slit-Lamp Biomicroscope\"",
    "2024 추계임상수의학회 / FAVA (Federation of Asian Veterinary Associations Congress) 발표 — \"Usefulness of Spectral Domain Optical Coherence Tomography (SD-OCT) for Treatment Selection and Prognosis Prediction of Corneal Lesions in 6 Dogs\" (우수발표상 수상)"
  ],
  "publications": [
    "Kim, Y., Kang, S., & Seo, K. (2026). Visualization of Ex Vivo Porcine Corneal Endothelial Cells Using Smartphone-Assisted Specular Reflection with Slit-Lamp Biomicroscopy. Veterinary Ophthalmology, 29(2), e70161.",
    "Lee, J., Kim, W., Shim, J., Kim, Y., Kang, S., Yoo, Y. K., Lee, Y. H., & Seo, K. (2026). Validation of Recalibrated TONOVET Plus and TONOVET Pro in Canine Eyes Compared to Manometer and TONOVET. Veterinary Ophthalmology, 29(1), e70002.",
    "Sung, H., Kang, S., Lee, S., Jang, Y., Kim, G., Kim, Y., & Seo, K. (2025). Evaluation of Changes in Lacrimal Canaliculi Width Depending on Temperature and Viscosity of Eye Drops Using Spectral-Domain Optical Coherence Tomography in Dogs. Veterinary Ophthalmology, 28(3), 583–592."
  ]
}
