[
  {
    "slug": "example-slug",
    "name": "홍길동",
    "title": "원장",
    "order": 1,
    "photo": "https://cdn.prod.website-files.com/.../profile.jpg",
    "intro": "한 줄 소개 (선택). 비워두면 자동 숨김.",
    "education": [
      "○○대학교 수의과대학 졸업",
      "○○대학교 수의외과학 석사"
    ],
    "career": [
      "前 ○○동물병원 진료부장",
      "現 헬릭스 동물의료센터 원장"
    ],
    "specialty": [
      "연부조직 외과",
      "정형외과"
    ],
    "memberships": [
      "한국수의외과학회 정회원"
    ],
    "activities": [
      "2025 한국수의외과학회 추계학술대회 발표"
    ],
    "publications": [
      "○○ 저널 게재 논문 (2024)"
    ]
  }
]
