{
  "slug": "gimjonggyeong",
  "name": "김종경",
  "title": "과장",
  "order": 2,
  "photo": "https://s3.amazonaws.com/webflow-prod-assets/69d090ea69d828e27d16ea29/6acc3b515f514da625d8c186_%EA%B9%80%EC%A2%85%EA%B2%BD.webp",
  "education": [
    "건국대학교 수의과대학 졸업"
  ],
  "career": [
    "현) 헬릭스동물메디컬센터 응급과장",
    "튼튼동물의료센터 응급과장 근무",
    "서울숲 동물병원 부원장 근무",
    "해마루 동물병원 ENC 응급중환자실 팀장 근무",
    "해마루 동물병원 인턴·레지던트 수료"
  ],
  "memberships": [
    "한국고양이수의사회 (KSFM) 정회원",
    "한국수의응급중환자의학연구회 (KVECCS) 정회원"
  ]
}
