{
  "slug": "baggimseohyeon",
  "name": "박김서현",
  "title": "팀장",
  "order": 2,
  "photo": "https://s3.amazonaws.com/webflow-prod-assets/69d090ea69d828e27d16ea29/6acc3b5117fd42feec7434e4_%EB%B0%95%EA%B9%80%EC%84%9C%ED%98%84.webp",
  "education": [
    "충남대학교 수의과대학 졸업"
  ],
  "activities": [
    "서울대학교 동물병원 내과학실 실습 (2023.05.29~06.09 / 2025.06.09~06.20)",
    "2025 춘계 서울수의사회 컨퍼런스 참여 (2025.03.29~03.30)",
    "2025 추계 서울수의사회 컨퍼런스 참여 (2025.09.20~09.21)",
    "한국수의임상학회 춘계학술대회 참여 (2024.05.26)",
    "2024 추계 서울수의사회 컨퍼런스 참여 (2024.09.28~09.29)",
    "Fear Free Veterinary Professional Certification Program 취득 (2023.09.28)"
  ]
}
