[
  {
    "slug": "gimyunji",
    "name": "김윤지",
    "title": "방사선사",
    "order": 1,
    "photo": "https://cdn.prod.website-files.com/6a0ebfa8ab876d4fea0840ca/6a18fcd8b5e0a78506661dd2_%EA%B9%80%EC%9C%A4%EC%A7%80.jpg",
    "education": ["신구대학교 방사선과 졸업"]
  },
  {
    "slug": "gimhyejin",
    "name": "김혜진",
    "title": "방사선사",
    "order": 2,
    "photo": "https://cdn.prod.website-files.com/6a0ebfa8ab876d4fea0840ca/6a18fcd13d9fd988458bc251_%EA%B9%80%ED%98%9C%EC%A7%84.jpg",
    "education": ["고려대학교 방사선학과 졸업"]
  }
]
