{
  "slug": "jangmunseog",
  "name": "장문석",
  "title": "과장",
  "order": 7,
  "photo": "https://s3.amazonaws.com/webflow-prod-assets/69d090ea69d828e27d16ea29/6acc3b51fc112b443e08d0ce_%EC%9E%A5%EB%AC%B8%EC%84%9D.webp",
  "education": [
    "충남대학교 임상수의학 박사 수료",
    "충남대학교 임상수의학 석사",
    "충남대학교 수의과대학 졸업"
  ],
  "career": [
    "현) 헬릭스동물메디컬센터 서초 본원 내과과장",
    "연성대학교 반려동물보건과 겸임교수",
    "충남대학교 부속동물병원 진료수의사 근무"
  ],
  "activities": [
    "2021 추계 한국임상수의학회 구두발표 — \"Use of Tetracycline and Niacinamide for Treatment of Pedal Furunculosis in a Dog\"",
    "2021 추계 한국임상수의학회 구두발표 — \"Eosinophilic Granuloma Treated with Prednisolone and Azathioprine in a Dog\""
  ],
  "publications": [
    "Kang R, Jang M, Lee W, Park S. Urticaria Pigmentosa Treated with Antihistamine in a Mixed Cat. J Vet Clin 2024;41:411-415.",
    "Jung Y, Jang M, Kang R, Lee W, Park S. Adjunctive Therapy of Pimecrolimus for Treatment of Facial Discoid Lupus Erythematosus in a Dog. J Vet Clin 2024;41:49-53.",
    "Jung Y, Jang M, Kang R, Lee W, Park S. Cutaneous Xanthoma in a Dog. J Vet Clin 2023;40:382-386.",
    "MS Jang. (2023). Pilot Study to Evaluate the Efficacy of Taurodeoxycholic Acid in Dogs with Atopic Dermatitis, 충남대학교",
    "Jang M, Lee W, Park S. Eosinophilic Granuloma Treated with Prednisolone and Azathioprine in a Dog. J Vet Clin 2022;39:192-196."
  ]
}
