{
  "slug": "seongcanju",
  "name": "성찬주",
  "title": "부장",
  "order": 3,
  "photo": "https://s3.amazonaws.com/webflow-prod-assets/69d090ea69d828e27d16ea29/6acc3b51ae8c81a4908c1509_%EC%84%B1%EC%B0%AC%EC%A3%BC.webp",
  "education": [
    "충북대학교 수의학과 내과 박사 수료",
    "충북대학교 수의학과 학사 졸업"
  ],
  "career": [
    "현) 헬릭스동물메디컬센터 서초 본원 내과부장",
    "전) 헬릭스동물메디컬센터 서초 본원 내과과장",
    "수원 마음반려동물의료원 내과과장 근무",
    "충북대학교 동물의료센터 내과 치프수의사",
    "충북대학교 동물의료센터 내과 진료수의사",
    "충북대학교 동물의료센터 인턴 수료"
  ],
  "memberships": [
    "한국고양이수의사회 정회원",
    "한국수의종양의학연구회 정회원"
  ],
  "activities": [
    "2024 한국수의임상학회 발표 — \"Comparison of Computed Tomographic Findings Between Perianal Tumors Originating from Anal Glands and Perianal Glands\"",
    "2024 FAVA 발표 — \"Computed tomography radiomics models of tumor differentiation in canine small intestinal tumors\"",
    "2018 충북대학교 동물의료센터 Grand Round — \"갑상샘기능항진증 고양이를 위한 방사성요오드 치료\"",
    "2018 American College of Veterinary Internal Medicine 포스터 발표 — \"Alterations in Oral and Fecal Microbiomes in Dogs with Chronic Kidney Disease\"",
    "2018 한국고양이수의사회지 article 기술 — \"갑상샘 신티그래피를 이용한 고양이 갑상샘기능항진증의 진단과 치료\"",
    "2017 춘계 한국임상수의학회 구두발표 — \"Resolution of Neurologic Signs After Administration of Levothyroxine in 3 Dogs with Hypothyroidism\"",
    "2017 American College of Veterinary Internal Medicine 포스터 발표 — \"Usefulness of Thyrotropin Stimulation Test in Dogs with Hypothyroidism, Non-Thyroidal Illness, or Receiving Hydrocortisone\"",
    "2017 미국 Animal Endocrine Clinic, New York 비지팅",
    "2017 Japanese Board of Veterinary Practitioners 19th Annual Meeting 참석",
    "2016 춘계 한국임상수의학회 구두발표 — \"Usefulness of TSH Stimulation Test in Dogs with Hypothyroidism, Non-Thyroidal Illness and Hydrocortisone Administration\"",
    "2016 BSAVA 소동물 내분비학 역자",
    "Veterinary Radiology & Ultrasound 학술지 리뷰어"
  ]
}
