{
  "slug": "igyeongsu",
  "name": "이경수",
  "title": "진료 수의사",
  "order": 3,
  "photo": "https://s3.amazonaws.com/webflow-prod-assets/69d090ea69d828e27d16ea29/6acc3b51a19716f481bbe1b1_%EC%9D%B4%EA%B2%BD%EC%88%98.webp",
  "education": [
    "제주대학교 수의과대학 졸업"
  ],
  "activities": [
    "2025 서울수의컨퍼런스 참가"
  ]
}
