[
  {
    "slug": "gimhyoju",
    "name": "김효주",
    "title": "원장",
    "order": 1,
    "photo": "https://cdn.prod.website-files.com/6a0ebfa8ab876d4fea0840ca/6a13b9fa37421d3256cc39cc_%EA%B9%80%ED%9A%A8%EC%A3%BC.jpg",
    "education": ["서울대학교 수의외과학 박사 수료"],
    "memberships": [
      "서울시수의사회 학술이사",
      "한국수의외과학회 일반외과 전공분과위원"
    ]
  },
  {
    "slug": "jeongdahong",
    "name": "정다홍",
    "title": "부장",
    "order": 2,
    "photo": "https://cdn.prod.website-files.com/6a0ebfa8ab876d4fea0840ca/6a13ba065dc5745ba382471d_%EC%A0%95%EB%8B%A4%ED%99%8D2.jpg",
    "education": ["건국대학교 수의외과학 석사 졸업"],
    "memberships": [
      "세계수의정형외과학회(AOVET) 정회원",
      "한국수의외과학회 정회원"
    ]
  }
]
