[
  {
    "slug": "joseongu",
    "name": "조성우",
    "title": "과장",
    "order": 4,
    "photo": "https://cdn.prod.website-files.com/6a0ebfa8ab876d4fea0840ca/6a13b75fbd624b7655ed8bfc_%EC%A1%B0%EC%84%B1%EC%9A%B0.jpg",
    "education": ["건국대학교 수의과대학 졸업"]
  },
  {
    "slug": "sonyeongmin",
    "name": "손영민",
    "title": "과장",
    "order": 5,
    "photo": "https://cdn.prod.website-files.com/6a0ebfa8ab876d4fea0840ca/6a13b751e1d9703da65fcdec_%EC%86%90%EC%98%81%EB%AF%BC.jpg",
    "education": ["경북대학교 수의내과학 석사 졸업"]
  },
  {
    "slug": "hongyiju",
    "name": "홍의주",
    "title": "과장",
    "order": 6,
    "photo": "https://cdn.prod.website-files.com/6a0ebfa8ab876d4fea0840ca/6a13b7469108cc68c1e0f2fe_%ED%99%8D%EC%9D%98%EC%A3%BC.jpg",
    "education": ["강원대학교 수의내과학 석사 졸업"]
  },
  {
    "slug": "jangmunseog",
    "name": "장문석",
    "title": "과장",
    "order": 7,
    "photo": "https://cdn.prod.website-files.com/6a0ebfa8ab876d4fea0840ca/6a18fb0c3f071bd24386fe80_%EC%9E%A5%EB%AC%B8%EC%84%9D.jpg",
    "education": ["충남대학교 수의내과학 박사 수료"],
    "memberships": ["연성대학교 반려동물보건과 겸임교수"]
  },
  {
    "slug": "imjihyeon",
    "name": "임지현",
    "title": "과장",
    "order": 8,
    "photo": "https://cdn.prod.website-files.com/6a0ebfa8ab876d4fea0840ca/6a18f9853d9fd988458b2d12_%EC%9E%84%EC%A7%80%ED%98%84.jpg",
    "education": ["서울대학교 수의내과학 석사 졸업"]
  }
]
