{
  "slug": "hansangjin",
  "name": "한상진",
  "title": "과장",
  "order": 1,
  "photo": "https://cdn.prod.website-files.com/6a0ebfa8ab876d4fea0840ca/6a18fed809bbdf4db7257fac_%ED%95%9C%EC%83%81%EC%A7%84-%EC%9E%AC%EB%AF%B8%EB%82%98%EC%9D%B4ver.jpg",
  "education": [
    "충남대학교 수의과대학 졸업"
  ],
  "career": [
    "현) 헬릭스동물메디컬센터 서초 본원 응급과장",
    "헬릭스동물메디컬센터 송파점 응급과장 근무",
    "우리동물병원 원장"
  ],
  "memberships": [
    "한국수의응급중환자의학회(KVECCS) 정회원"
  ]
}
