[
  {
    "slug": "guhaein",
    "name": "구해인",
    "title": "과장",
    "order": 1,
    "photo": "https://cdn.prod.website-files.com/6a0ebfa8ab876d4fea0840ca/6a18f9f6d503d973ad1cf4a3_%EA%B5%AC%ED%95%B4%EC%9D%B8.jpg",
    "education": ["서울대학교 수의외과학 석사 졸업"]
  },
  {
    "slug": "coejimin",
    "name": "최지민",
    "title": "과장",
    "order": 2,
    "photo": "https://cdn.prod.website-files.com/6a0ebfa8ab876d4fea0840ca/6a18fc2111c56f2ed134345b_%EC%B5%9C%EC%A7%80%EB%AF%BC.png",
    "education": ["건국대학교 수의외과학 석사 졸업"],
    "memberships": [
      "한국수의외과학회 정회원",
      "국제수의정형외과 학술단체 AOVET 정회원"
    ]
  },
  {
    "slug": "hanjuyeol",
    "name": "한주열",
    "title": "과장",
    "order": 3,
    "photo": "https://cdn.prod.website-files.com/6a0ebfa8ab876d4fea0840ca/6a18fa51c09615aa85466191_%ED%95%9C%EC%A3%BC%EC%97%B4.jpg",
    "education": ["건국대학교 수의외과학 석사 졸업"],
    "memberships": [
      "한국수의외과학회 정회원",
      "국제수의정형외과 학술단체 AOVET 정회원"
    ]
  }
]
