{
  "slug": "hongyiju",
  "name": "홍의주",
  "title": "과장",
  "order": 6,
  "photo": "https://s3.amazonaws.com/webflow-prod-assets/69d090ea69d828e27d16ea29/6acc879bc1eea5af072a3cd5_%ED%99%8D%EC%9D%98%EC%A3%BC.webp",
  "education": [
    "강원대학교 수의과대학 소동물내과학 석사 졸업",
    "강원대학교 수의과대학 졸업"
  ],
  "career": [
    "강원대학교 부속동물병원 진료수의사 근무"
  ],
  "activities": [
    "2024 ACVIM Conference 참석",
    "2022 ACVIM Conference 참석"
  ]
}
