{
  "slug": "imjihyeon",
  "name": "임지현",
  "title": "과장",
  "order": 8,
  "photo": "https://s3.amazonaws.com/webflow-prod-assets/69d090ea69d828e27d16ea29/6acc879933e846e23b8f66ee_%EC%9E%84%EC%A7%80%ED%98%84.webp",
  "education": [
    "서울대학교 수의과대학 수의내과학 석사 졸업",
    "건국대학교 수의과대학 수의학과 졸업"
  ],
  "career": [
    "서울대학교 동물병원 내과 수련의 및 전공의 과정",
    "서울대학교 수의과대학 수의내과학교실 조교",
    "해마루동물병원 응급중환자의료센터 진료의 근무",
    "서울동물메디컬센터 내과 진료의 근무",
    "2024 WSAVA Certification of Small Animal Endoscopy"
  ],
  "activities": [
    "2026 춘계 임상수의학회 구두 발표 — \"Symptom-Based Clinical Deterioration as a Patient-Centered Endpoint in Canine Urothelial Carcinoma\"",
    "2025 FSAVA 포스터 발표 — \"A Case of Systemic Protothecosis in a Dog Receiving Chronic Immunosuppressive Treatment\"",
    "2023 춘계 임상수의학회 포스터 발표 — \"Hypochloridemia as a Negative Prognostic Factor in Acute Congestive Heart Failure Dogs\"",
    "2023 추계 임상수의학회 포스터 발표 — \"Severe Leukocytosis as a Leukemoid Reaction in a Sepsis Dog\"",
    "2023 해마루동물병원 임상수의학 기본과정 강사",
    "2022 FVMA Feline Hepatology and Gastroenterology",
    "2022 대웅재단 해외학술대회 중계프로그램 참가, 프레젠테이션 발표 — \"Feline Cholangitis/Cholangiohepatitis Complex\""
  ],
  "publications": [
    "JH Lim. (2026). Analysis of Symptom-Based Deterioration Timing and Its Clinical Relevance in Dogs with Urothelial Carcinoma, 서울대학교"
  ]
}
