{
  "slug": "gimyumin",
  "name": "김유민",
  "title": "과장",
  "order": 1,
  "photo": "https://s3.amazonaws.com/webflow-prod-assets/69d090ea69d828e27d16ea29/6acc3b51ee76a28b3170bd2e_%EA%B9%80%EC%9C%A0%EB%AF%BC.webp",
  "education": [
    "제주대학교 수의과대학 졸업",
    "이화여자대학교 분자생명과학부"
  ],
  "activities": [
    "제주대학교 임상로테이션 수료",
    "롯데장학재단 36기 장학생"
  ]
}
